"№","Дата публикации","Дата изменения","Тип","Категория","Источник","Город","Адрес","Метро","Этаж","Этажность","Площадь, м2","Площадь земли, сот.","Стоимость","Телефон","Номер защищен","Имя контакта","Агент","Ссылка","Материал","Описание","Изображения"
"259197665","21.07.2026 08:39 +03:00","21.07.2026 08:39 +03:00","Продам","Дом/Коттедж","cian.ru","Другие","с. Максимовщина","-","-","1","63,0","17,0","5 430 000 руб.","+7 (914) 951-23-81","Защищен","-","-","https://irkutsk.cian.ru/sale/suburban/332186599","","Продам дом, теплый, уютный (6*7 и веранда 3*7), в селе Максимовщина ( ИЖС). 300 метров от реки Иркут. Собственник, торг уместен. Хорошие подъездные пути( асфальт), до центра села две минуты. Возможно разделить участок пополам и продать, вернув около половины стоимости дома. Участки сейчас около 2, 5-3 млн. руб за 7-8 соток. Живописные места, от Иркутска 8 км. Сразу за воротами- бескрайние луга-сотни гектар-очень удобно для выпаса с/ хозживотных. Участок разработан, удобрен. Теплица 2026г. На участке летняя кухня(4*4 ) и веранда (2*4), бревенчатая, утеплённая, обшита доской, можно для зимнего проживания( тещин домик). Баня ( обшита вагонкой) с предбанником. Стайка из бруса, обшита доской. Коптилка - вмещает 100-150 кг мясной или рыбной продукции( как коптить- расскажем). И др. надворные постройки. Дом построен из газоблоков, утеплен( базальт), обшит металопрофилем. В доме есть погреб( сухой, тёплый большой, обложен блоками, оштукатурен, побелен). Все окна в доме пластиковые. Хорошая входная дверь с электроподогревом. Мебель из дома вывезена, комнаты свободны. Септик 3 кольца. Электричество 380 Вольт, подстанция час через два дома, напряжение отличное круглый год. От нашего забора до домов соседей около 100 метров - очень тихо и пожаробезопасно. Мансарда с балконом, внутри без отделки. В селе есть школа 11 как лассов ( до неё 5 минут пешком), детсад, аптека, ДК, почта, храм Святой Троицы, поликлиника, МФЦ, ОЗОН, Вайлдберриз, тренажерный зал, маршрутка ходит до города каждые 30 минут. Все в собственности, документы готовы, 1 взрослый собственник, больше никто не прописан. Фасадная сторона участка и ворота из Профлиста + палисадник. Цена 5 430 000р. ТОРГ. Чистая продажа.","https://images.cdn-cian.ru/images/dom-maksimovshcina-2927028204-1.jpg,https://images.cdn-cian.ru/images/dom-maksimovshcina-2927022188-1.jpg,https://images.cdn-cian.ru/images/dom-maksimovshcina-2927022179-1.jpg,https://images.cdn-cian.ru/images/dom-maksimovshcina-2927028755-1.jpg,https://images.cdn-cian.ru/images/dom-maksimovshcina-2927022210-1.jpg,https://images.cdn-cian.ru/images/dom-maksimovshcina-2927028206-1.jpg,https://images.cdn-cian.ru/images/dom-maksimovshcina-2927022205-1.jpg,https://images.cdn-cian.ru/images/dom-maksimovshcina-2927028756-1.jpg,https://images.cdn-cian.ru/images/dom-maksimovshcina-2927022173-1.jpg,https://images.cdn-cian.ru/images/dom-maksimovshcina-2927028207-1.jpg,https://images.cdn-cian.ru/images/dom-maksimovshcina-2927028201-1.jpg,https://images.cdn-cian.ru/images/dom-maksimovshcina-2927028209-1.jpg,https://images.cdn-cian.ru/images/dom-maksimovshcina-2927022181-1.jpg,https://images.cdn-cian.ru/images/dom-maksimovshcina-2927028205-1.jpg,https://images.cdn-cian.ru/images/dom-maksimovshcina-2927022159-1.jpg,https://images.cdn-cian.ru/images/dom-maksimovshcina-2927032591-1.jpg,https://images.cdn-cian.ru/images/dom-maksimovshcina-2927030458-1.jpg,https://images.cdn-cian.ru/images/dom-maksimovshcina-2927032590-1.jpg,https://images.cdn-cian.ru/images/dom-maksimovshcina-2927032592-1.jpg,https://images.cdn-cian.ru/images/dom-maksimovshcina-2927030460-1.jpg,https://images.cdn-cian.ru/images/dom-maksimovshcina-2927030462-1.jpg,https://images.cdn-cian.ru/images/dom-maksimovshcina-2927032584-1.jpg,https://images.cdn-cian.ru/images/dom-maksimovshcina-2927032589-1.jpg,https://images.cdn-cian.ru/images/dom-maksimovshcina-2927030480-1.jpg,https://images.cdn-cian.ru/images/dom-maksimovshcina-2927032554-1.jpg,https://images.cdn-cian.ru/images/dom-maksimovshcina-2927032581-1.jpg,https://images.cdn-cian.ru/images/dom-maksimovshcina-2927032593-1.jpg,https://images.cdn-cian.ru/images/dom-maksimovshcina-2927032587-1.jpg,https://images.cdn-cian.ru/images/dom-maksimovshcina-2927032586-1.jpg,https://images.cdn-cian.ru/images/dom-maksimovshcina-2927030472-1.jpg,https://images.cdn-cian.ru/images/dom-maksimovshcina-2927031449-1.jpg,https://images.cdn-cian.ru/images/dom-maksimovshcina-2927032561-1.jpg,https://images.cdn-cian.ru/images/dom-maksimovshcina-2927032560-1.jpg,https://images.cdn-cian.ru/images/dom-maksimovshcina-2927032557-1.jpg,https://images.cdn-cian.ru/images/dom-maksimovshcina-2927031469-1.jpg,https://images.cdn-cian.ru/images/dom-maksimovshcina-2927031468-1.jpg,https://images.cdn-cian.ru/images/dom-maksimovshcina-2927032559-1.jpg"
"241116674","01.10.2025 21:36 +03:00","21.07.2026 08:39 +03:00","Продам","Дом/Коттедж","cian.ru","Хомутово","с. Хомутово, ул. Доготарева, 11","-","-","2","208,0","12,0","9 500 000 руб.","+7 (914) 870-84-90","Защищен","-","-","https://irkutsk.cian.ru/sale/suburban/322457709","","Продаю 2 благоустроенных дома расположенных на одном участке в с.Хомутово, м-н Западный. Дома соединены между собой теплым кирпичным переходом с витражными окнами в пол.В каждом доме своя скважина,подвал,септик,система отопления. Строили для себя на красивом и ровном участке площадью 12 соток. Дом теплый, выполнен качественный ремонт, натяжные потолки, полы из кедровой доски. Участок огорожен дорогим забором из кирпича, дом с гаражом на 2 машиноместа с автоматическими воротами. В доме имеется сухое подполье. Оплата за коммунальные платежи только за электричество. Есть дополнительные системы бесперебойного отопления в случае отключения света. В каждом доме по 15 кВт, т.е. на домовладение 30 кВт! что большая редкость. 2 скважины с питьевой водой. Дом прекрасно подходит для жизни большой семьи. В доме прекрасная планировка. В главном 2х этажном доме площадью 150 кв.м. расположены: 3 спальные комнаты, просторная гостиная со столовой зоной, ванная комната. На втором этаже большой балкон с витражным остеклением. На второй этаж ведет красивая кованая лестница. Во втором доме площадью 80 кв.м. расположены: шикарная баня-сауна и большая гостиная со столовой зоной. Баня выполнена из кедровой доски и установлена немецкая печь, выполнена на заказ. В каждом доме своя скважина, канализация, отопление, горячая вода. Новым собственникам остается вся встроенная мебель/гардеробные, барная стойка и мягкая мебель. Дом находится на не затопляемой местности. Отличная транспортная развязка, улица асфальтированная и освещенная прямо до дома, перед домом большое парковочное место, помимо гаража на 2 машины. В шаговой доступности: остановки, дет. сады, магазины. Двор и заезд залиты бетоном, на всей территории участка имеются асфальтированные дорожки, участок полностью разработан, облагорожен, ровный, сухой. Установлены 2 теплицы, сделаны грядки, есть все плодовые и ягодные насаждения, прекрасные ели, много красивых многолетних цветов, есть лужайка, засеяная канадской травкой с лежаками для отдыха и местом для барбекю. Дома не требуют вложений. Продажа в связи с переездом в другой регион. Цена ниже себестоимости. Собственник! Документы готовы к продаже, 1 собственник, обременений нет. Звоните, пишите, отвечу на все интересующие вопросы.","https://images.cdn-cian.ru/images/dom-homutovo-dogotareva-ulica-2651056444-1.jpg,https://images.cdn-cian.ru/images/dom-homutovo-dogotareva-ulica-2651056453-1.jpg,https://images.cdn-cian.ru/images/dom-homutovo-dogotareva-ulica-2651056459-1.jpg,https://images.cdn-cian.ru/images/dom-homutovo-dogotareva-ulica-2651056449-1.jpg,https://images.cdn-cian.ru/images/dom-homutovo-dogotareva-ulica-2651056473-1.jpg,https://images.cdn-cian.ru/images/dom-homutovo-dogotareva-ulica-2651056479-1.jpg,https://images.cdn-cian.ru/images/dom-homutovo-dogotareva-ulica-2651056346-1.jpg,https://images.cdn-cian.ru/images/dom-homutovo-dogotareva-ulica-2651284597-1.jpg,https://images.cdn-cian.ru/images/dom-homutovo-dogotareva-ulica-2651056454-1.jpg,https://images.cdn-cian.ru/images/dom-homutovo-dogotareva-ulica-2651056354-1.jpg,https://images.cdn-cian.ru/images/dom-homutovo-dogotareva-ulica-2651056360-1.jpg,https://images.cdn-cian.ru/images/dom-homutovo-dogotareva-ulica-2651056377-1.jpg,https://images.cdn-cian.ru/images/dom-homutovo-dogotareva-ulica-2651056411-1.jpg,https://images.cdn-cian.ru/images/dom-homutovo-dogotareva-ulica-2651056433-1.jpg,https://images.cdn-cian.ru/images/dom-homutovo-dogotareva-ulica-2651056345-1.jpg,https://images.cdn-cian.ru/images/dom-homutovo-dogotareva-ulica-2651056429-1.jpg,https://images.cdn-cian.ru/images/dom-homutovo-dogotareva-ulica-2651056428-1.jpg,https://images.cdn-cian.ru/images/dom-homutovo-dogotareva-ulica-2651056365-1.jpg,https://images.cdn-cian.ru/images/dom-homutovo-dogotareva-ulica-2651284596-1.jpg,https://images.cdn-cian.ru/images/dom-homutovo-dogotareva-ulica-2651056349-1.jpg,https://images.cdn-cian.ru/images/dom-homutovo-dogotareva-ulica-2651056415-1.jpg,https://images.cdn-cian.ru/images/dom-homutovo-dogotareva-ulica-2651056356-1.jpg"
"256795502","16.06.2026 12:48 +03:00","21.07.2026 08:39 +03:00","Продам","Дом/Коттедж","cian.ru","Мегет","пос. Мегет, ул. Долгожданная, 29","-","-","1","36,0","15,0","3 999 950 руб.","+7 (914) 921-40-23","Защищен","-","-","https://irkutsk.cian.ru/sale/suburban/330113248","","Продаётся ухоженный участок 15 соток (ИЖС) с жилым домом, баней и полным набором построек. Земля подготовлена, забор капитальный, соседи спокойные и дружелюбные. Подходит как для круглогодичного проживания, так и дачного хозяйства. 1 собственник, без обременений, ипотек и залогов. Документы готовы к быстрой сделке. **УЧАСТОК И ЗАБОР** 15 соток ИЖС, ровный, правильной формы Полностью огорожен, со стороны дороги надёжный кирпичный забор Большая свободная площадка под строительство нового дома **ДОМ (36 м²)** Стены: шлакоблок + утеплитель + облицовочный кирпич Отопление: печное + электрическое (пригоден для круглогодичного проживания) Просторный подвал для хранения заготовок Пристроена веранда **ХОЗПОСТРОЙКИ И УДОБСТВА** Гараж (утеплённый, шлакоблок+кирпич) для техники и инвентаря Баня из бруса Хозблоки, дровник с запасом дров Летний кирпичный душ и уличный туалет Водоколонка на участке, оборудованная насосом **КОММУНИКАЦИИ** Электричество: счётчик установлен, подключение официальное Газ: баллоны + плита для кухни Водоснабжение: насосная колонка на территории **САД И ОГОРОД** Теплица, парники, готовые грядки Плодовые: яблони, ранетки, груша Ягодные: жимолость, крыжовник, малина, клубника Земля удобрена и ухожена урожай гарантирован с первого сезона **В ПОДАРОК ПОКУПАТЕЛЮ** Мебель, полный садовый инвентарь и большой набор строительных инструментов. Заезжайте и сразу начинайте жить и хозяйствовать! **ОКРУЖЕНИЕ** Тихая, обжитая улица. Соседи доброжелательные, участок находится в хорошем окружении. Подъезд круглогодичный.","https://images.cdn-cian.ru/images/dom-meget-dolgozhdannaya-ulica-2881443008-1.jpg,https://images.cdn-cian.ru/images/dom-meget-dolgozhdannaya-ulica-2881442971-1.jpg,https://images.cdn-cian.ru/images/dom-meget-dolgozhdannaya-ulica-2881442922-1.jpg,https://images.cdn-cian.ru/images/dom-meget-dolgozhdannaya-ulica-2881442930-1.jpg,https://images.cdn-cian.ru/images/dom-meget-dolgozhdannaya-ulica-2881443446-1.jpg,https://images.cdn-cian.ru/images/dom-meget-dolgozhdannaya-ulica-2881443552-1.jpg,https://images.cdn-cian.ru/images/dom-meget-dolgozhdannaya-ulica-2881455721-1.jpg,https://images.cdn-cian.ru/images/dom-meget-dolgozhdannaya-ulica-2881455724-1.jpg,https://images.cdn-cian.ru/images/dom-meget-dolgozhdannaya-ulica-2881455705-1.jpg,https://images.cdn-cian.ru/images/dom-meget-dolgozhdannaya-ulica-2881455722-1.jpg,https://images.cdn-cian.ru/images/dom-meget-dolgozhdannaya-ulica-2881455723-1.jpg,https://images.cdn-cian.ru/images/dom-meget-dolgozhdannaya-ulica-2881455719-1.jpg,https://images.cdn-cian.ru/images/dom-meget-dolgozhdannaya-ulica-2881443926-1.jpg,https://images.cdn-cian.ru/images/dom-meget-dolgozhdannaya-ulica-2881443879-1.jpg,https://images.cdn-cian.ru/images/dom-meget-dolgozhdannaya-ulica-2881455714-1.jpg,https://images.cdn-cian.ru/images/dom-meget-dolgozhdannaya-ulica-2881454036-1.jpg"
"249328095","22.02.2026 09:24 +03:00","21.07.2026 08:39 +03:00","Продам","Дом/Коттедж","cian.ru","Хомутово","с. Хомутово, пер. Одесский, 8","-","-","2","114,5","8,0","6 550 000 руб.","+7 (914) 010-45-67","Защищен","-","-","https://irkutsk.cian.ru/sale/suburban/327146308","","Срочно Снизили цену на 10 дней 6.800.000. Объявление от собственника Уважаемые покупатели, предоставляю Вашему вниманию дом из бруса 18/18 На ровном участке, не топит, земля хорошая. Находится дом в закрытом переулке, с площадкой ГТО, с замечательными и отзывчивыми соседями, Дом в хорошем состоянии. В доме расположено -3 спальни и просторная кухня -гостиная. В двух комнатах сделан качественный ремонт. Второй этаж в перспективе. В доме :два водонагревателя, новый насос, отопление :водянной теплый пол, скважина, септик 4 куба. Также установлены фильтра, дом обслуживался во время. Большая терраса выходит на задний участок. На нем расположено: небольшой аккуратный огородик,дорожки закрыты геотекстилем и отсыпаны щебнем, теплица поликарбонат 3-2м., Детская площадка, песочница. Высажены ягодные культуры. Построен новый гараж 5/8м., Есть кладовая 4/2 м Установлена новая с терморазрывом, 4-х камерная входная дверь, предназначена для дома, не квартиры. Ищем новых хозяев для нашего любимого дома. Продаем дом из за переезда. Подходит любая оплата. Дом не в ипотеке, залога и обременений нет. По документам все в порядке. Рядом магазины продуктовые в шаговой доступности и остановка 3-4 мин. Детей возит с этой же остановки Мечта+ школьный автобус. Очень удачное расположение дома. Если возникли вопросы, звоните.","https://images.cdn-cian.ru/images/dom-homutovo-odesskiy-pereulok-2812829889-1.jpg,https://images.cdn-cian.ru/images/dom-homutovo-odesskiy-pereulok-2812829941-1.jpg,https://images.cdn-cian.ru/images/dom-homutovo-odesskiy-pereulok-2812830245-1.jpg,https://images.cdn-cian.ru/images/dom-homutovo-odesskiy-pereulok-2812830127-1.jpg,https://images.cdn-cian.ru/images/dom-homutovo-odesskiy-pereulok-2812829999-1.jpg,https://images.cdn-cian.ru/images/dom-homutovo-odesskiy-pereulok-2812830242-1.jpg,https://images.cdn-cian.ru/images/dom-homutovo-odesskiy-pereulok-2812830219-1.jpg,https://images.cdn-cian.ru/images/dom-homutovo-odesskiy-pereulok-2812830110-1.jpg,https://images.cdn-cian.ru/images/dom-homutovo-odesskiy-pereulok-2812830055-1.jpg,https://images.cdn-cian.ru/images/dom-homutovo-odesskiy-pereulok-2812830334-1.jpg,https://images.cdn-cian.ru/images/dom-homutovo-odesskiy-pereulok-2812830369-1.jpg,https://images.cdn-cian.ru/images/dom-homutovo-odesskiy-pereulok-2812830325-1.jpg,https://images.cdn-cian.ru/images/dom-homutovo-odesskiy-pereulok-2812830493-1.jpg,https://images.cdn-cian.ru/images/dom-homutovo-odesskiy-pereulok-2812830483-1.jpg,https://images.cdn-cian.ru/images/dom-homutovo-odesskiy-pereulok-2812830506-1.jpg,https://images.cdn-cian.ru/images/dom-homutovo-odesskiy-pereulok-2812830644-1.jpg,https://images.cdn-cian.ru/images/dom-homutovo-odesskiy-pereulok-2812830632-1.jpg,https://images.cdn-cian.ru/images/dom-homutovo-odesskiy-pereulok-2812844635-1.jpg,https://images.cdn-cian.ru/images/dom-homutovo-odesskiy-pereulok-2812831296-1.jpg,https://images.cdn-cian.ru/images/dom-homutovo-odesskiy-pereulok-2812844645-1.jpg,https://images.cdn-cian.ru/images/dom-homutovo-odesskiy-pereulok-2812831516-1.jpg,https://images.cdn-cian.ru/images/dom-homutovo-odesskiy-pereulok-2812844613-1.jpg,https://images.cdn-cian.ru/images/dom-homutovo-odesskiy-pereulok-2812844637-1.jpg,https://images.cdn-cian.ru/images/dom-homutovo-odesskiy-pereulok-2812874157-1.jpg,https://images.cdn-cian.ru/images/dom-homutovo-odesskiy-pereulok-2812874279-1.jpg,https://images.cdn-cian.ru/images/dom-homutovo-odesskiy-pereulok-2812874240-1.jpg,https://images.cdn-cian.ru/images/dom-homutovo-odesskiy-pereulok-2854174890-1.jpg,https://images.cdn-cian.ru/images/dom-homutovo-odesskiy-pereulok-2877768528-1.jpg,https://images.cdn-cian.ru/images/dom-homutovo-odesskiy-pereulok-2877768346-1.jpg,https://images.cdn-cian.ru/images/dom-homutovo-odesskiy-pereulok-2877768791-1.jpg,https://images.cdn-cian.ru/images/dom-homutovo-odesskiy-pereulok-2877768050-1.jpg,https://images.cdn-cian.ru/images/dom-homutovo-odesskiy-pereulok-2877767938-1.jpg,https://images.cdn-cian.ru/images/dom-homutovo-odesskiy-pereulok-2877780229-1.jpg,https://images.cdn-cian.ru/images/dom-homutovo-odesskiy-pereulok-2877780145-1.jpg,https://images.cdn-cian.ru/images/dom-homutovo-odesskiy-pereulok-2877780109-1.jpg,https://images.cdn-cian.ru/images/dom-homutovo-odesskiy-pereulok-2877780274-1.jpg,https://images.cdn-cian.ru/images/dom-homutovo-odesskiy-pereulok-2889478430-1.jpg,https://images.cdn-cian.ru/images/dom-homutovo-odesskiy-pereulok-2889478457-1.jpg,https://images.cdn-cian.ru/images/dom-homutovo-odesskiy-pereulok-2889478424-1.jpg,https://images.cdn-cian.ru/images/dom-homutovo-odesskiy-pereulok-2889477786-1.jpg,https://images.cdn-cian.ru/images/dom-homutovo-odesskiy-pereulok-2889477992-1.jpg,https://images.cdn-cian.ru/images/dom-homutovo-odesskiy-pereulok-2889484616-1.jpg,https://images.cdn-cian.ru/images/dom-homutovo-odesskiy-pereulok-2889477776-1.jpg,https://images.cdn-cian.ru/images/dom-homutovo-odesskiy-pereulok-2889477959-1.jpg,https://images.cdn-cian.ru/images/dom-homutovo-odesskiy-pereulok-2889484489-1.jpg,https://images.cdn-cian.ru/images/dom-homutovo-odesskiy-pereulok-2899237479-1.jpg,https://images.cdn-cian.ru/images/dom-homutovo-odesskiy-pereulok-2905283622-1.jpg,https://images.cdn-cian.ru/images/dom-homutovo-odesskiy-pereulok-2905283530-1.jpg,https://images.cdn-cian.ru/images/dom-homutovo-odesskiy-pereulok-2905285739-1.jpg,https://images.cdn-cian.ru/images/dom-homutovo-odesskiy-pereulok-2905285732-1.jpg"
