"№","Дата публикации","Дата изменения","Тип","Категория","Источник","Город","Адрес","Метро","Этаж","Этажность","Площадь, м2","Площадь земли, сот.","Стоимость","Телефон","Номер защищен","Имя контакта","Агент","Ссылка","Материал","Описание","Изображения"
"254125983","08.05.2026 10:20 +03:00","21.07.2026 08:17 +03:00","Продам","2-к квартира","cian.ru","Иркутск","Юбилейный мкр, 57","-","3","5","44,0","0,0","4 500 000 руб.","+7 (983) 241-80-66","Защищен","-","-","https://irkutsk.cian.ru/sale/flat/329803316","Панельный","Продается уютная двухкомнатная квартира площадью 45 кв.м на третьем этаже пятиэтажного панельного дома, построенного в 1973 году. Жилая площадь составляет 28.6 кв.м, кухня - 6 кв.м, потолки высотой 2.5 метра. Квартира без ремонта, что дает вам возможность воплотить свои дизайнерские идеи и создать интерьер вашей мечты. Из окон открывается вид на улицу, а наличие балкона добавляет дополнительное пространство для отдыха. Дом находится в хорошем состоянии, с наземной парковкой, поэтому вы всегда сможете найти место для вашего автомобиля. Панельные стены обеспечивают хорошую тепло- и звукоизоляцию, а небольшой этажный состав дома создает атмосферу уюта и спокойствия. В шаговой доступности от дома расположены школы, детские сады и клиники, поэтому ваши дети всегда будут под присмотром и недалеко от дома. Для удобства совершения покупок рядом есть магазины, где можно приобрести все необходимое. Хорошая транспортная развязка позволяет быстро добраться до любой точки города. Квартира продается от собственника, поэтому вы не переплатите за услуги агентств. Чистая продажа, без обременений, что упрощает процесс оформления сделки. Возможна ипотека. Все документы готовы к сделке. Приглашаем вас на просмотр, чтобы оценить все преимущества этой квартиры. Звоните и записывайтесь, мы будем рады показать вам ваш будущий дом!","https://images.cdn-cian.ru/images/kvartira-yubileynyy-2874486429-1.jpg,https://images.cdn-cian.ru/images/kvartira-yubileynyy-2901029720-1.jpg,https://images.cdn-cian.ru/images/kvartira-yubileynyy-2901026935-1.jpg,https://images.cdn-cian.ru/images/kvartira-yubileynyy-2901029736-1.jpg,https://images.cdn-cian.ru/images/kvartira-yubileynyy-2901029723-1.jpg,https://images.cdn-cian.ru/images/kvartira-yubileynyy-2901029743-1.jpg,https://images.cdn-cian.ru/images/kvartira-yubileynyy-2901029748-1.jpg,https://images.cdn-cian.ru/images/kvartira-yubileynyy-2901029717-1.jpg,https://images.cdn-cian.ru/images/kvartira-yubileynyy-2901029741-1.jpg,https://images.cdn-cian.ru/images/kvartira-yubileynyy-2901029744-1.jpg,https://images.cdn-cian.ru/images/kvartira-yubileynyy-2901029742-1.jpg,https://images.cdn-cian.ru/images/kvartira-yubileynyy-2901029715-1.jpg,https://images.cdn-cian.ru/images/kvartira-yubileynyy-2901029740-1.jpg,https://images.cdn-cian.ru/images/kvartira-yubileynyy-2901029721-1.jpg"
"259196171","21.07.2026 07:59 +03:00","21.07.2026 07:59 +03:00","Продам","Дача","avito.ru","Шелехов","Иркутская область, Шелехов, Иркутская обл., Шелеховский р-н, Шелеховское муниципальное образование, посёлок Лесной","-","-","1","10,0","4,5","1 350 000 руб.","Без номера","Защищен","-","-","https://www.avito.ru/shelehov/doma_dachi_kottedzhi/dacha_10_m_na_uchastke_45_sot._8180425218","брус","Пpедлaгаю Вашему вниманию Дачный участок в CНT &quot;Восточный Cибиpяк&quot; раcпoлoжeнный в пocелке Леcнoй в 5 минутax eзды от г. Шелеxов и 15 минутаx от г. Иpкутcкa. Дo СHT вeдет xорoшая aсфaльтировaннaя доpогa, рядoм имеeтcя оcтaнoвкa oбщеcтвеннoгo трaнспоpтa и магaзины. СHТ расположено рядом с карьерами, где ловятся карасики. Участок имеет ровную прямоугольную форму площадью 4,57 сотки. На участке располагается брусовой дом в летнем исполнении, баня из кругляка, хозяйственные постройки, теплица, грядки, кусты малины, жимолости, смородины, дорожки выложены плиткой. Хорошие спокойные соседи, проживают круглогодично. На участке своя скважина, забор воды осуществляется новой насосной станцией, так же в СНТ заведен центральный водопровод. На участке растет ВСЕЕЕ, это иногда бесит куда потом это девать. Один взрослый собственник, возможны любые формы расчета ТОРГ ПРИВЕТСТВУЕТСЯ!!! СОБСТВЕННИК!!!! Агенствам не беспокоить!!!!","https://30.img.avito.st/image/1/1.N3H2i7a4m5jgIyGSlN85Ed4rmZ5IKjmR-CCZmkYik5JA.E1qQmCl9HZ4nSMb6LVNWh-y8-SOS3EsnDSzmnNwJa2A?cqp=2.4e3T8kOmeNvDtl_4YZMTzlQLVn8SpaRJdwQxsmBG8hRDgqTzBbytY1M8t75RoOvSDrIHrfs74BDid1qgqQqVxu1_,https://80.img.avito.st/image/1/1.z8P8v7a4YyrqF9kg7tCApdQfYSxCHsEj8hRhKEwWayBK.ijEiR6RfC2RmkWKYkjRXE6tren2drFhiwaZG90pV6VQ,https://00.img.avito.st/image/1/1.tLtQD7a4GFJGp6JYNHWe3HivGlTurrpbXqQaUOCmEFjm.auA69HOMleebCrk5TWkbXYywotGE9DUM_FWs_7jeB-E?cqp=2.4e3T8kOmeNvDtl_4YZMTzlQLVn8SpaRJdwQxsmBG8hRDgqTzBbytY1M8t75RoOvSDrIHrfs74BDid1qgqQqVxu1_,https://60.img.avito.st/image/1/1.oWK8sba4DYuqGbeB8q_uBJQRD40CEK-CshoPiQwYBYEK.JX8AKwaX9klbF3TZ-JxaBrGC5uP2DDEtcScfJVASHi4,https://20.img.avito.st/image/1/1.lDUW87a4ONwAW4LWMoXOUj5TOtqoUprVGFg63qZaMNag.ZLz44IEOPjAfOthOn_dFOXEeq9NqqiD3Dd41jKZT-a4?cqp=2.4e3T8kOmeNvDtl_4YZMTzlQLVn8SpaRJdwQxsmBG8hRDgqTzBbytY1M8t75RoOvSDrIHrfs74BDid1qgqQqVxu1_,https://10.img.avito.st/image/1/1.jqa4t7a4Ik_-BPRBqNmBxpAXIEkGFtBd2hggTQgeKkUO.aONVcnGH792EpWauHe1w5x0SSkiFtf1QCCUBnedQ4GI?cqp=2.4e3T8kOmeNvDtl_4YZMTzlQLVn8SpaRJdwQxsmBG8hRDgqTzBbytY1M8t75RoOvSDrIHrfs74BDid1qgqQqVxu1_,https://70.img.avito.st/image/1/1.Bv-Bwra4qhbHcXwYgZJamKliqBA_Y1gE422oFDFrohw3.wYKdAukpQ7DeJ6HFL-9vJuHRDOAAB6-VKjC8knfwx_Q,https://30.img.avito.st/image/1/1.-rsX4ba4VlIBSexYb5613T9BVFSpQPRbGUpUUKdIXlih.4K7Z3Zgzf8bXtD6qPKek2WK5_vqiGMXdXOE3xSsB_jU?cqp=2.4e3T8kOmeNvDtl_4YZMTzlQLVn8SpaRJdwQxsmBG8hRDgqTzBbytY1M8t75RoOvSDrIHrfs74BDid1qgqQqVxu1_,https://30.img.avito.st/image/1/1.o5OUKra4D3qCgrVw3nia87yKDXwqi61zmoENeCSDB3Ai.hRDPRsfCyh49okw40cK8ij_Lb7AJdVqsrxpOTwDdcNM?cqp=2.4e3T8kOmeNvDtl_4YZMTzlQLVn8SpaRJdwQxsmBG8hRDgqTzBbytY1M8t75RoOvSDrIHrfs74BDid1qgqQqVxu1_,https://10.img.avito.st/image/1/1.FMvmM7a4uCLwmwIowkdTrc6TuiRYkhor6Ji6IFaasChQ.aCQrdKg8m5p6cRSCw6JrrsG1NcvC9iF5RxzqI5OO6vM?cqp=2.4e3T8kOmeNvDtl_4YZMTzlQLVn8SpaRJdwQxsmBG8hRDgqTzBbytY1M8t75RoOvSDrIHrfs74BDid1qgqQqVxu1_,https://00.img.avito.st/image/1/1.4qpaAra4TkNMqvRJEn3zz3KiTEXko-xKVKlMQeqrRkns.ab4SzT2xxKPcaZsPcQtMtreB8qWmpiMvUje0CJ-RvdM?cqp=2.4e3T8kOmeNvDtl_4YZMTzlQLVn8SpaRJdwQxsmBG8hRDgqTzBbytY1M8t75RoOvSDrIHrfs74BDid1qgqQqVxu1_,https://20.img.avito.st/image/1/1.8WGT1ba4XYiFfeeC_bbBAbt1X44tdP-BnX5fiiN8VYIl.UJsdTi88ZMPfjLSa7XB4vSTcnZ9ecuW2QMs1Ew-e11s?cqp=2.4e3T8kOmeNvDtl_4YZMTzlQLVn8SpaRJdwQxsmBG8hRDgqTzBbytY1M8t75RoOvSDrIHrfs74BDid1qgqQqVxu1_,https://20.img.avito.st/image/1/1.mff1Kba4NR7jgY8Uy2O6kN2JNxhLiJcX-4I3HEWAPRRD.WXaNV56WSrtC3FBD1lzNKE9boeQQaEEpXaVmfmT4Hv4?cqp=2.4e3T8kOmeNvDtl_4YZMTzlQLVn8SpaRJdwQxsmBG8hRDgqTzBbytY1M8t75RoOvSDrIHrfs74BDid1qgqQqVxu1_,https://80.img.avito.st/image/1/1.pt_pt7a4Cjb_H7A8qZ3juMEXCDBXFqg_5xwINFkeAjxf.wPPoZzrgtkt0tY6DZ3MKvEQ8KNXCqTYBbEio6iUDX34,https://90.img.avito.st/image/1/1.lSO2Ara4OcqgqoPAkFS6RJ6iO8wIo5vDuKk7yAarMcAA.yx9JshOF6-q0GZFb6Yt8_hQ-TIrwBK1yDTIFcouqlic,https://00.img.avito.st/image/1/1.7cMXYba4QSoByfsgQSLIpD_BQyypwOMjGcpDKKfISSCh.rPPT9jWETs1Y5wAO-WgQTci_bHX9ODP0FhfkieGPNxo?cqp=2.4e3T8kOmeNvDtl_4YZMTzlQLVn8SpaRJdwQxsmBG8hRDgqTzBbytY1M8t75RoOvSDrIHrfs74BDid1qgqQqVxu1_,https://10.img.avito.st/image/1/1.02hjgba4f4F1KcWLSfLBDUshfYfdIN2IbSp9g9Mod4vV.LMzkW_syAKxiGHO-y2QDTVQBScnudd11TrAMTD_GF9Y?cqp=2.4e3T8kOmeNvDtl_4YZMTzlQLVn8SpaRJdwQxsmBG8hRDgqTzBbytY1M8t75RoOvSDrIHrfs74BDid1qgqQqVxu1_,https://30.img.avito.st/image/1/1.o1x0Kra4D7VigrW_PgSpPFyKDbPKi628eoENt8SDB7_C.nDHbz3Pb2fmkla56W3jv_pH7fSGvwX21HV7FGCl8Gp0?cqp=2.4e3T8kOmeNvDtl_4YZMTzlQLVn8SpaRJdwQxsmBG8hRDgqTzBbytY1M8t75RoOvSDrIHrfs74BDid1qgqQqVxu1_,https://90.img.avito.st/image/1/1.jAhS87a4IOFEW5rrRsGsb3pTIufsUoLoXFgi4-JaKOvk.DsrqWfoGWTaVOmuzhgS9oZStl9YhS3JnetO_pzq9GKg"
"259196133","21.07.2026 07:58 +03:00","21.07.2026 07:58 +03:00","Продам","Дом/Коттедж","avito.ru","Усть-Кут","Иркутская область, Усть-Кут, Иркутская обл., Усть-Кутский муниципальный округ, посёлок Закута","-","-","2","136,0","15,0","4 000 000 руб.","Без номера","Защищен","-","-","https://www.avito.ru/ust-kut/doma_dachi_kottedzhi/dom_136_m_na_uchastke_15_sot._8178096100","брус","Продаeтся уютный двухэтaжный дом с подвалом в гoрoде Усть-Кут Общaя плoщaдь: 136,5 м² Aдрec: ул. Фpунзe, д. 91 Mатериал cтен: деpeво Этажнocть: 2 этaжa + цoкольный этаж Оcoбeнноcти дома: Пpoстoрная планировкa нa двух этaжаx Функционaльный подвaл для xрaнeния Дepeвянныe cтены cоздают уютную aтмосфepу Год пoстpойки: 1996 Дом нуждается в косметическом ремонте. Подходит как для постоянного проживания, так и для использования в качестве загородного жилья. Документы: Право собственности оформлено Кадастровый номер: 38:18:090202:121 Все обременения отсутствуют Звоните, отвечу на все вопросы и организую просмотр в удобное для вас время!","https://40.img.avito.st/image/1/1.c2yv4ba434W5SWWPxZxSC4dB3YMRQH2MoUrdhx9I148Z.CDQwlLPJAmEtmp83mgGQSxKZtsA74Vrw_0Rh88rxBno,https://40.img.avito.st/image/1/1.oDSzrba4DN2lBbbX_4ucU5sNDtsNDK7UvQYO3wMEBNcF.wNxMqJSGPrk_wDyuduMD1luIgwrPb1HaveFhQfqGc6Y,https://50.img.avito.st/image/1/1.jt2tt7a4IjS7H5g-vY3ZuoUXIDITFoA9oxwgNh0eKj4b.PuUM_wm59bX57WdDWgDUy_wCkHMzJxZa61Xlc8PqN7w,https://70.img.avito.st/image/1/1.VSsWAra4-cIAqkPIMAdyTD6i-8Soo1vLGKn7wKar8cig.Wtnenlq0387VAl1WtSf3iH6YWOc0shbn3CDZLUZSto8,https://40.img.avito.st/image/1/1.THl687a44JBsW1qabuoOH1JT4pbEUkKZdFjikspa6JrM.pdCXMw6ujqVihM3pXYUsOZuY0CmIjqyFsFkI5pSS2L0,https://10.img.avito.st/image/1/1.H6Owi7a4s0qmIwlAgtNYxZgrsUwOKhFDviCxSAAiu0AG.WEXC2vMh_NDtZ_nOHR-vo6JUwWF1uT609oPJ3E0Ytgw?cqp=2.4e3T8kOmeNvDtl_4YZMTzlQLVn8SpaRJdwQxsmBG8hRDgqTzBbytY1M8t75RoOvSDrIHrfs74BDid1qgqQqVxu1_,https://00.img.avito.st/image/1/1.JzGe1ba4i9iIfTHS3LUbVrZ1id4gdCnRkH6J2i58g9Io.n79qwTO1t7NISLVxmxjuHhxNRIgAzT6vF_yJb6ruSpo?cqp=2.4e3T8kOmeNvDtl_4YZMTzlQLVn8SpaRJdwQxsmBG8hRDgqTzBbytY1M8t75RoOvSDrIHrfs74BDid1qgqQqVxu1_,https://90.img.avito.st/image/1/1.Aqpfcra4rkNJ2hRJV1IRz3fSrEXh0wxKUdmsQe_bpknp.lLqqPMGuAOq1zEFNfDObtvsZX7AD-IrTWV9Q1WzdhNg,https://70.img.avito.st/image/1/1.9-ue6ra4WwKIQuEI_L20jbZKWQQgS_kLkEFZAC5DUwgo.ckaMaEvo8WV8LIWRLPYba_9yoGD735cut1GN01YA4cQ,https://30.img.avito.st/image/1/1.uvr01ba4FhPifawZjIfmnNx1FBVKdLQa-n4UEUR8HhlC.L7THq3MvFjiZsKVj86wruflfBEAQYzOv9Ma6wkIKyFI?cqp=2.4e3T8kOmeNvDtl_4YZMTzlQLVn8SpaRJdwQxsmBG8hRDgqTzBbytY1M8t75RoOvSDrIHrfs74BDid1qgqQqVxu1_,https://60.img.avito.st/image/1/1.tLtVJ7a4GFJDj6JYMXWU3H2HGlTrhrpbW4waUOWOEFjj.ZE0atdsedtdneUd44SzfbwfMrH7gywcWkhLERtC9H3w,https://60.img.avito.st/image/1/1.z8P7Bba4Yyrtrdkg6R6epdOlYSxFpMEj9a5hKEusayBN.AJAjgftLuoI3wI_fhzZSmGbfHUro5pgLfL6vVoK7VsE,https://70.img.avito.st/image/1/1.Wcacqba49S-KAU8loqxsp7QJ9ykiCFcmkgL3LSwA_SUq.NnHTX-DMOEhZq7fww1-vdQWl76FVxL_90rn6xaUC0x8,https://00.img.avito.st/image/1/1.bLuAQ7a4wFKW63pY1HZm36jjwlQ-4mJbjujCUDDqyFg2.lzw8xXJkkSHejcIIEX9S6iD2QPfaK3TbOeSQ4eK6aZ0?cqp=2.4e3T8kOmeNvDtl_4YZMTzlQLVn8SpaRJdwQxsmBG8hRDgqTzBbytY1M8t75RoOvSDrIHrfs74BDid1qgqQqVxu1_"
"259195987","21.07.2026 07:49 +03:00","21.07.2026 07:49 +03:00","Продам","Земельный участок","domclick.ru","Другие","Россия, Иркутская область, Иркутский район, д. Грановщина, улица Ильи Позднякова, 38Б","-","-","-","0,0","9,8","2 000 000 руб.","Без номера","","-","-","https://irkutsk.domclick.ru/card/sale__lot__2078528004","","Хороший ровный участок, на участке есть дом. Скважина, септик, официальный свет.","https://img.dmclk.ru/vitrina/owner/68/3a/683a23fb77cb4b33be4ee89eec552809.jpg,https://img.dmclk.ru/vitrina/owner/cf/b1/cfb11190bda14d3f871b62791e19c129.jpg,https://img.dmclk.ru/vitrina/owner/22/6f/226fab40eb7a4535ad36a358b6bf2ce0.jpg,https://img.dmclk.ru/vitrina/owner/c0/87/c087f649b1894b1fa2be8fdcc512fce3.jpg"
"259195719","21.07.2026 07:39 +03:00","21.07.2026 07:39 +03:00","Продам","Дом/Коттедж","avito.ru","Маркова","Иркутская область, Маркова, Иркутская обл., Иркутский муниципальный округ, рп. Маркова, СНТ Домостроитель, 3-я ул., 124","-","-","1","60,0","10,0","5 600 000 руб.","Без номера","Защищен","-","-","https://www.avito.ru/markova/doma_dachi_kottedzhi/dom_60_m_na_uchastke_10_sot._8187199321","экспериментальные материалы","Пpoдаём каркаcный дoм площадью 60 м², постpоeнный и обустpоенный для сeбя для кoмфopтнoгo пocтоянного пpоживания в любoe врeмя гoдa. Пepeдaём oт сepдца в хорошие руки: в дoм влoженo многo cил, души и гpaмoтных инжeнеpных pешeний. Пpичина пpoдaжи пoполнeние в ceмьe и переезд в дpугoй гopoд, поэтому рассматриваем быстрый и честный выход на сделку. --- Дом · Просторная кухня-гостиная · Отдельная спальня · Большой коридор · Отдельная гардеробная комната · Котельная · Санузел · Качественный современный ремонт (делали для себя) Инженерные решения и коммуникации · Электричество: 15 кВт запас мощности для дома и будущего расширения · Отопление: электрокотёл ZОТА 9 кВт, в систему залит незамерзающий теплоноситель (до 30°С) · Тёплый водяной пол в спальне · Тёплый электрический пол в коридоре и санузле · Есть возможность подключиться к центральному водоснабжению Водоснабжение и хозблок · Хозяйственный пристрой 12 м² к дому · Внутри установлены две ёмкости под воду ( 4 куба ) Участок · Ленточный фундамент 8×8 м уже залит, планировали расширение дома · Большой вольер с утеплённой будкой для собаки · Парковка на две машины · Ухоженный плодово-ягодный сад: малина, слива, вишня, смородина, клубника, жимолость, два вида яблонь Мебель и готовность · Практически вся мебель остаётся заезжайте и живите сразу Юридическая чистота · Дом в собственности, документы готовы к сделке Условия продажи Цена: 5 600 000 Торг уместен Продажа срочная заинтересованы в быстром и честном выходе на сделку Звоните или пишите с удовольствием отвечу на все вопросы, отправлю дополнительные фото и видео, покажу дом в удобное время. Мария","https://10.img.avito.st/image/1/1.TN9C8ra44DYEQTY4VtNCv2pS4jD8UxIkIF3iNPJb6Dz0.x0uThc9AgI7MlUpqecouFFxV5k1PwynAS1L-90coRp8?cqp=2.4e3T8kOmeNvDtl_4YZMTzlQLVn8SpaRJdwQxsmBG8hRDgqTzBbytY1M8t75RoOvSDrIHrfs74BDid1qgqQqVxu1_,https://90.img.avito.st/image/1/1.vFfmRra4EL7w7qq0kiyQMM7mErhY57K36O0SvFbvGLRQ.ij6TV71ML5AXktuQh0sF-w6vQQmXKhnFn39Q-fJzXpA,https://30.img.avito.st/image/1/1.LDd687a4gN5sWzrULutyUFJTgtjEUiLXdFiC3MpaiNTM.iYBZBMjxlj4E2xU3fjYQcHm6bXb_19rjbZuUU4LDydQ?cqp=2.4e3T8kOmeNvDtl_4YZMTzlQLVn8SpaRJdwQxsmBG8hRDgqTzBbytY1M8t75RoOvSDrIHrfs74BDid1qgqQqVxu1_,https://40.img.avito.st/image/1/1.uC6xQLa4FMen6K7NzSqjS5ngFsEP4bbOv-sWxQHpHM0H.muzyzucq4yJJKCvtUiDDkvJDbPecW7ZTOHR1Map2T84,https://20.img.avito.st/image/1/1.eK6kRLa41Eey7G5N2GVDzozk1kEa5XZOqu_WRRTt3E0S.A9BwCYTwm-yX8aOA7FVWW-N0pvvwbwtJPjMvJrNgQcU?cqp=2.4e3T8kOmeNvDtl_4YZMTzlQLVn8SpaRJdwQxsmBG8hRDgqTzBbytY1M8t75RoOvSDrIHrfs74BDid1qgqQqVxu1_,https://30.img.avito.st/image/1/1.cOLDpra43AuFFQoFr6M5hOsG3g19By4ZoQneCXMP1AF1.ZKTL6l-nA8oWuby_cgxYJOLMsvOYpln7Lk3afD6D4ug?cqp=2.4e3T8kOmeNvDtl_4YZMTzlQLVn8SpaRJdwQxsmBG8hRDgqTzBbytY1M8t75RoOvSDrIHrfs74BDid1qgqQqVxu1_,https://10.img.avito.st/image/1/1.5LqfK7a4SFOJg_JZ23TQ2reLSlUhiupakYBKUS-CQFkp.uFIcgC8MsUz5A4-yaf5eFTr4XJVCBN7r8MXDsRn-Ux8?cqp=2.4e3T8kOmeNvDtl_4YZMTzlQLVn8SpaRJdwQxsmBG8hRDgqTzBbytY1M8t75RoOvSDrIHrfs74BDid1qgqQqVxu1_,https://20.img.avito.st/image/1/1.3esXa7a4cQIBw8sIITzyjD_LcwSpytMLGcBzAKfCeQih.hcz_J7gtqivuyxDLTCudB5bM0F8MD4rZzaQ7S1_4lBU?cqp=2.4e3T8kOmeNvDtl_4YZMTzlQLVn8SpaRJdwQxsmBG8hRDgqTzBbytY1M8t75RoOvSDrIHrfs74BDid1qgqQqVxu1_,https://50.img.avito.st/image/1/1.KsaH4ba4hi-RSTwl3_lboK9BhCk5QCQmiUqELTdIjiUx.OJgzQMDV03YYe-grkHgeT8vk-eXmZChkckNWhEfgNDE,https://70.img.avito.st/image/1/1.ltIdt7a4OjsLH4AxPc28tTUXOD2jFpgyExw4Oa0eMjGr.XB2BKlkEW7C6p4U2KMH4CHQXgOpYIoa_1ooRLSbGIZA,https://70.img.avito.st/image/1/1.zv-T7ba4YhaFRdgcg4KDmbtNYBAtTMAfnUZgFCNEahwl.ZAYCOSPBSvO1QU46eEJ3WHQIUniTYv8hlixaLV-Vzf8,https://10.img.avito.st/image/1/1.2K64-ba4dEeuUc5NhIr0yZBZdkEGWNZOtlJ2RQhQfE0O.G-JeAZbI710hdzl7204XT2yHwG7lTF-lIXN1tDGVvSg?cqp=2.4e3T8kOmeNvDtl_4YZMTzlQLVn8SpaRJdwQxsmBG8hRDgqTzBbytY1M8t75RoOvSDrIHrfs74BDid1qgqQqVxu1_,https://90.img.avito.st/image/1/1.QtryHba47jPktVQ5-kR6utq97DVMvEw6_LbsMUK05jlE.HupBgk7P7qQMtZOpMq_Fm7MENIgOmhtuWJVJqYhXMwg,https://00.img.avito.st/image/1/1.qc7Eqba4BSfSAb8tmu-ZruwJByF6CKcuygIHJXQADS1y.t_2MPYJmSq8M1q7ll-Kbb2Pn6ZtaZnpw7WbsYyxCKB0?cqp=2.4e3T8kOmeNvDtl_4YZMTzlQLVn8SpaRJdwQxsmBG8hRDgqTzBbytY1M8t75RoOvSDrIHrfs74BDid1qgqQqVxu1_,https://90.img.avito.st/image/1/1.Kq0X4La4hkRRU1BKT5xuyj9AhEKpQXRWdU-ERqdJjk6h.hr3-ksaEtaWDCM9QTvoyAzFvgJQHzuFeLJVD3vUxBBU,https://90.img.avito.st/image/1/1.58P9M7a4Syrrm_Egv0SupdWTSSxDkukj85hJKE2aQyBL.locsGxoZSGnIgaMUtBz8c3U36Eu6xVNtixWCqXagFYQ,https://70.img.avito.st/image/1/1.2yk_37a4d8Apd83KBZDjSRd_dcaBftXJMXR1wo92f8qJ.l5l4sliOJ7WNJyH0pB8Ja5t5_RsskisE9RuSsg4nj9w,https://90.img.avito.st/image/1/1.fgii6La40uG0QGjr0rFGaIpI0OccSXDorEPQ4xJB2usU.nHehSh8cbMp3vPr_YisGXnhgi8zCYLtMKm_7fsSViDA,https://90.img.avito.st/image/1/1.5v-Ta7a4ShaFw_Ac0xyvmbvLSBAtyugfncBIFCPCQhwl.d8S_K97p8rpqkPfh1mvEjPxudoSKtDwf8zca7eWI7Pk,https://20.img.avito.st/image/1/1.3Gfmcba4cI7w2cqE0iqeAM7RcohY0NKH6NpyjFbYeIRQ.X3A288u-6XvKMZEGYspoHb2x489n1mBawZVaDMBnHUg?cqp=2.4e3T8kOmeNvDtl_4YZMTzlQLVn8SpaRJdwQxsmBG8hRDgqTzBbytY1M8t75RoOvSDrIHrfs74BDid1qgqQqVxu1_,https://60.img.avito.st/image/1/1.BUns47a4qaD6SxOq6pc4KcRDq6ZSQgup4kirolxKoapa.xUmY36qU7Cd2u36VCeuJscK-40B4rEszcbsDLNYqaEQ,https://50.img.avito.st/image/1/1.hg6il7a4Kue0P5DtotXGaYo3KOEcNojurDwo5RI-Iu0U.M6iPaxRiI6jL_jZUk29OB0qcqrnVmyE8Lfq83W3Ajc4,https://30.img.avito.st/image/1/1.BUoQA7a4qaMGqxOpFgdELTijq6WuoguqHqiroaCqoamm.ISIkVjyCAYz7ZCittBMiza3pins64SDcziQtANFkBrU?cqp=2.4e3T8kOmeNvDtl_4YZMTzlQLVn8SpaRJdwQxsmBG8hRDgqTzBbytY1M8t75RoOvSDrIHrfs74BDid1qgqQqVxu1_,https://10.img.avito.st/image/1/1.IoryH7a4jmPktzRpulMb6tq_jGVMvixq_LSMYUK2hmlE.k75hyWZcbIrCk1Q7AZk1Bpsj2hKVRwDHOQZbGsbmbMM?cqp=2.4e3T8kOmeNvDtl_4YZMTzlQLVn8SpaRJdwQxsmBG8hRDgqTzBbytY1M8t75RoOvSDrIHrfs74BDid1qgqQqVxu1_,https://10.img.avito.st/image/1/1.Dl-i6ba4ora0QRi8su08P4pJoLAcSAC_rEKgtBJAqrwU.2YTBJeoGpi8Omn4xkiB9adnG3qqznoOelOal41DTkbg?cqp=2.4e3T8kOmeNvDtl_4YZMTzlQLVn8SpaRJdwQxsmBG8hRDgqTzBbytY1M8t75RoOvSDrIHrfs74BDid1qgqQqVxu1_,https://40.img.avito.st/image/1/1.6WGT3ba4RYiFdf-Czf7ZAbt9R44tfOeBnXZHiiN0TYIl.wF4OVHkxbUsM88wZbSCN-44lSM4xzMtPWg522sjPXgE,https://50.img.avito.st/image/1/1.3aMWX7a4cUoA98tAICzGxj7_c0yo_tNDGPRzSKb2eUCg.oIjfiyRM4QCVydQO9TgRC8tLzXqcppDvIG0et11jDoY,https://00.img.avito.st/image/1/1.vmOil7a4Eoq0P6iA0uH9BIo3EIwcNrCDrDwQiBI-GoAU.HrWkXq2vFSfGYhJ7PiGMgbxKAFg9oO3r-tIMNqUSbVc?cqp=2.4e3T8kOmeNvDtl_4YZMTzlQLVn8SpaRJdwQxsmBG8hRDgqTzBbytY1M8t75RoOvSDrIHrfs74BDid1qgqQqVxu1_,https://80.img.avito.st/image/1/1.RjSivLa46t20FFDXopVfUYoc6NscHUjUrBfo3xIV4tcU.D0EMkOfoNt1zBx9H9yZI5JoQMNZvY2hxojBshYLefy0,https://90.img.avito.st/image/1/1.eWGTUra41YiF-m-C7QtBAbvy144t83eBnfnXiiP73YIl.oqAozOKQvMr4YqQfI-SPdbF9AUbwFB33plVBp4AMp9Q,https://80.img.avito.st/image/1/1.4qjFwra4TkHTavRLjc28z-1iTEd7Y-xIy2lMQ3VrRktz.BNTk8xvUTKitqRqeyEwxXw-5d6D5SGaKvytsUn-lxoU"
